{
  "schema_version": 1,
  "venue_id": "TC",
  "year": null,
  "track": "regular",
  "submission_stage": "submission",
  "publication_type": "journal",
  "official_source_urls": [
    "https://www.computer.org/csdl/journal/tc/write-for-us"
  ],
  "last_verified_date": null,
  "rules": {
    "paper_length_policy": {
      "value": null,
      "source_url": null,
      "source_type": "unknown",
      "verified_at": null,
      "applies_to": {
        "venue_id": "TC",
        "year": null,
        "track": "regular",
        "submission_stage": "submission"
      },
      "verification_status": "unverified",
      "notes": "UNKNOWN: no verified applicable official rule retained; consult exact target instructions."
    },
    "reference_page_policy": {
      "value": null,
      "source_url": null,
      "source_type": "unknown",
      "verified_at": null,
      "applies_to": {
        "venue_id": "TC",
        "year": null,
        "track": "regular",
        "submission_stage": "submission"
      },
      "verification_status": "unverified",
      "notes": "UNKNOWN: no verified applicable official rule retained; consult exact target instructions."
    },
    "appendix_supplementary_policy": {
      "value": null,
      "source_url": null,
      "source_type": "unknown",
      "verified_at": null,
      "applies_to": {
        "venue_id": "TC",
        "year": null,
        "track": "regular",
        "submission_stage": "submission"
      },
      "verification_status": "unverified",
      "notes": "UNKNOWN: no verified applicable official rule retained; consult exact target instructions."
    },
    "template_requirements": {
      "value": null,
      "source_url": null,
      "source_type": "unknown",
      "verified_at": null,
      "applies_to": {
        "venue_id": "TC",
        "year": null,
        "track": "regular",
        "submission_stage": "submission"
      },
      "verification_status": "unverified",
      "notes": "UNKNOWN: no verified applicable official rule retained; consult exact target instructions."
    },
    "anonymity_requirements": {
      "value": null,
      "source_url": null,
      "source_type": "unknown",
      "verified_at": null,
      "applies_to": {
        "venue_id": "TC",
        "year": null,
        "track": "regular",
        "submission_stage": "submission"
      },
      "verification_status": "unverified",
      "notes": "UNKNOWN: no verified applicable official rule retained; consult exact target instructions."
    },
    "review_criteria": {
      "value": null,
      "source_url": null,
      "source_type": "unknown",
      "verified_at": null,
      "applies_to": {
        "venue_id": "TC",
        "year": null,
        "track": "regular",
        "submission_stage": "submission"
      },
      "verification_status": "unverified",
      "notes": "UNKNOWN: no verified applicable official rule retained; consult exact target instructions."
    },
    "ai_disclosure_requirements": {
      "value": null,
      "source_url": null,
      "source_type": "unknown",
      "verified_at": null,
      "applies_to": {
        "venue_id": "TC",
        "year": null,
        "track": "regular",
        "submission_stage": "submission"
      },
      "verification_status": "unverified",
      "notes": "UNKNOWN: no verified applicable official rule retained; consult exact target instructions."
    },
    "artifact_reproducibility_policy": {
      "value": null,
      "source_url": null,
      "source_type": "unknown",
      "verified_at": null,
      "applies_to": {
        "venue_id": "TC",
        "year": null,
        "track": "regular",
        "submission_stage": "submission"
      },
      "verification_status": "unverified",
      "notes": "UNKNOWN: no verified applicable official rule retained; consult exact target instructions."
    },
    "writing_style_guidance": {
      "value": {
        "kind": "independent_guidance",
        "items": [
          "Build claim-evidence argument before prose; preserve technical meaning and state limitations."
        ]
      },
      "source_url": null,
      "source_type": "field_methodology",
      "verified_at": null,
      "applies_to": {
        "venue_id": "TC",
        "year": null,
        "track": "regular",
        "submission_stage": "submission"
      },
      "verification_status": "unverified",
      "notes": "Independent Paper Craft advice; not an official rule or a sampled venue convention."
    },
    "field_specific_evaluation_priorities": {
      "value": {
        "kind": "independent_guidance",
        "items": [
          "Distinguish measured silicon, RTL, cycle simulation, analytical models and estimates.",
          "Check workload/baseline fairness and claim-specific performance, area, energy and timing evidence."
        ]
      },
      "source_url": null,
      "source_type": "field_methodology",
      "verified_at": null,
      "applies_to": {
        "venue_id": "TC",
        "year": null,
        "track": "regular",
        "submission_stage": "submission"
      },
      "verification_status": "unverified",
      "notes": "Independent field methodology, select metrics by claim; not mandatory venue review criteria."
    }
  },
  "writing_style_observations": [],
  "notes": "Continuing journal profile; year=null explicitly. Publisher/special-issue rules are not transferred to regular submissions. Official author page unavailable during verification (transport failure/403); requirements remain UNKNOWN. No special-issue page limit imported."
}
