{
  "schema_version": 1,
  "venue_id": "PACT",
  "year": 2026,
  "track": "research",
  "submission_stage": "submission",
  "publication_type": "conference",
  "official_source_urls": [
    "https://pact2026.github.io/submit/"
  ],
  "last_verified_date": "2026-10-08",
  "rules": {
    "paper_length_policy": {
      "value": {
        "max_pages": 10,
        "basis": "main"
      },
      "source_url": "https://pact2026.github.io/submit/",
      "source_type": "call_for_papers",
      "verified_at": "2026-10-08",
      "applies_to": {
        "venue_id": "PACT",
        "year": 2026,
        "track": "research",
        "submission_stage": "submission"
      },
      "verification_status": "verified",
      "notes": "Submission Guidelines: Format"
    },
    "reference_page_policy": {
      "value": {
        "excluded": true,
        "limit": null
      },
      "source_url": "https://pact2026.github.io/submit/",
      "source_type": "call_for_papers",
      "verified_at": "2026-10-08",
      "applies_to": {
        "venue_id": "PACT",
        "year": 2026,
        "track": "research",
        "submission_stage": "submission"
      },
      "verification_status": "verified",
      "notes": "Submission Guidelines: Format"
    },
    "appendix_supplementary_policy": {
      "value": {
        "separate_file": true,
        "format": "one anonymized PDF",
        "review_optional": true
      },
      "source_url": "https://pact2026.github.io/submit/",
      "source_type": "call_for_papers",
      "verified_at": "2026-10-08",
      "applies_to": {
        "venue_id": "PACT",
        "year": 2026,
        "track": "research",
        "submission_stage": "submission"
      },
      "verification_status": "verified",
      "notes": "Submission Guidelines: Supplementary Material"
    },
    "template_requirements": {
      "value": {
        "required": false,
        "documentclass": "acmart",
        "options": [
          "sigconf"
        ],
        "font_size_pt": 9
      },
      "source_url": "https://pact2026.github.io/submit/",
      "source_type": "call_for_papers",
      "verified_at": "2026-10-08",
      "applies_to": {
        "venue_id": "PACT",
        "year": 2026,
        "track": "research",
        "submission_stage": "submission"
      },
      "verification_status": "verified",
      "notes": "Submission Guidelines: ACM double-column layout; sigconf given as example"
    },
    "anonymity_requirements": {
      "value": {
        "double_blind": true,
        "scope": "Names, affiliations, revealing self-references; third-person prior-work citations."
      },
      "source_url": "https://pact2026.github.io/submit/",
      "source_type": "call_for_papers",
      "verified_at": "2026-10-08",
      "applies_to": {
        "venue_id": "PACT",
        "year": 2026,
        "track": "research",
        "submission_stage": "submission"
      },
      "verification_status": "verified",
      "notes": "Submission Guidelines: Double-Blind Review"
    },
    "review_criteria": {
      "value": [
        "Novelty, technical soundness, relevance, and clear evidence for parallel architecture/compiler advances."
      ],
      "source_url": "https://pact2026.github.io/submit/",
      "source_type": "call_for_papers",
      "verified_at": "2026-10-08",
      "applies_to": {
        "venue_id": "PACT",
        "year": 2026,
        "track": "research",
        "submission_stage": "submission"
      },
      "verification_status": "verified",
      "notes": "Research Papers evaluation criteria"
    },
    "ai_disclosure_requirements": {
      "value": null,
      "source_url": null,
      "source_type": "unknown",
      "verified_at": null,
      "applies_to": {
        "venue_id": "PACT",
        "year": 2026,
        "track": "research",
        "submission_stage": "submission"
      },
      "verification_status": "unverified",
      "notes": "UNKNOWN: no verified applicable official rule retained; consult exact target instructions."
    },
    "artifact_reproducibility_policy": {
      "value": null,
      "source_url": null,
      "source_type": "unknown",
      "verified_at": null,
      "applies_to": {
        "venue_id": "PACT",
        "year": 2026,
        "track": "research",
        "submission_stage": "submission"
      },
      "verification_status": "unverified",
      "notes": "UNKNOWN: no verified applicable official rule retained; consult exact target instructions."
    },
    "writing_style_guidance": {
      "value": {
        "kind": "official_guidance",
        "items": [
          "Abstract under 300 words; figures readable without magnification."
        ]
      },
      "source_url": "https://pact2026.github.io/submit/",
      "source_type": "call_for_papers",
      "verified_at": "2026-10-08",
      "applies_to": {
        "venue_id": "PACT",
        "year": 2026,
        "track": "research",
        "submission_stage": "submission"
      },
      "verification_status": "verified",
      "notes": "Submission Guidelines"
    },
    "field_specific_evaluation_priorities": {
      "value": {
        "kind": "independent_guidance",
        "items": [
          "Connect hardware/software interaction to a tested bottleneck and causal design rationale.",
          "Use matched models, workloads and accuracy targets; report integration overhead and end-to-end effects."
        ]
      },
      "source_url": null,
      "source_type": "field_methodology",
      "verified_at": null,
      "applies_to": {
        "venue_id": "PACT",
        "year": 2026,
        "track": "research",
        "submission_stage": "submission"
      },
      "verification_status": "unverified",
      "notes": "Independent field methodology, select metrics by claim; not mandatory venue review criteria."
    }
  },
  "writing_style_observations": [],
  "notes": "Exact named edition and track only; historical edition cannot establish a later edition's rules."
}
