{
  "schema_version": 1,
  "venue_id": "OSDI",
  "year": 2026,
  "track": "operational-systems",
  "submission_stage": "submission",
  "publication_type": "conference",
  "official_source_urls": [
    "https://www.usenix.org/conference/osdi26/call-for-papers",
    "https://www.usenix.org/conference/osdi26/requirements-authors"
  ],
  "last_verified_date": "2026-10-08",
  "rules": {
    "paper_length_policy": {
      "value": {
        "max_pages": 12,
        "basis": "main"
      },
      "source_url": "https://www.usenix.org/conference/osdi26/call-for-papers",
      "source_type": "call_for_papers",
      "verified_at": "2026-10-08",
      "applies_to": {
        "venue_id": "OSDI",
        "year": 2026,
        "track": "operational-systems",
        "submission_stage": "submission"
      },
      "verification_status": "verified",
      "notes": "Formatting"
    },
    "reference_page_policy": {
      "value": {
        "excluded": true,
        "limit": null
      },
      "source_url": "https://www.usenix.org/conference/osdi26/call-for-papers",
      "source_type": "call_for_papers",
      "verified_at": "2026-10-08",
      "applies_to": {
        "venue_id": "OSDI",
        "year": 2026,
        "track": "operational-systems",
        "submission_stage": "submission"
      },
      "verification_status": "verified",
      "notes": "Formatting"
    },
    "appendix_supplementary_policy": {
      "value": {
        "extra_appendix_pages": false
      },
      "source_url": "https://www.usenix.org/conference/osdi26/requirements-authors",
      "source_type": "submission_guidelines",
      "verified_at": "2026-10-08",
      "applies_to": {
        "venue_id": "OSDI",
        "year": 2026,
        "track": "operational-systems",
        "submission_stage": "submission"
      },
      "verification_status": "verified",
      "notes": "Requirements for Authors: Formatting"
    },
    "template_requirements": {
      "value": {
        "required": false,
        "documentclass": null,
        "options": [],
        "font_size_pt": 10,
        "columns": 2
      },
      "source_url": "https://www.usenix.org/conference/osdi26/call-for-papers",
      "source_type": "call_for_papers",
      "verified_at": "2026-10-08",
      "applies_to": {
        "venue_id": "OSDI",
        "year": 2026,
        "track": "operational-systems",
        "submission_stage": "submission"
      },
      "verification_status": "verified",
      "notes": "Formatting"
    },
    "anonymity_requirements": {
      "value": {
        "double_blind": true,
        "scope": "Author identities and institutions; revealing references/acknowledgments."
      },
      "source_url": "https://www.usenix.org/conference/osdi26/call-for-papers",
      "source_type": "call_for_papers",
      "verified_at": "2026-10-08",
      "applies_to": {
        "venue_id": "OSDI",
        "year": 2026,
        "track": "operational-systems",
        "submission_stage": "submission"
      },
      "verification_status": "verified",
      "notes": "Anonymity"
    },
    "review_criteria": {
      "value": [
        "Operational design, implementation, analysis, experience; validate known techniques in new settings and disclose deployment lessons."
      ],
      "source_url": "https://www.usenix.org/conference/osdi26/call-for-papers",
      "source_type": "call_for_papers",
      "verified_at": "2026-10-08",
      "applies_to": {
        "venue_id": "OSDI",
        "year": 2026,
        "track": "operational-systems",
        "submission_stage": "submission"
      },
      "verification_status": "verified",
      "notes": "Submission Tracks: Operational Systems"
    },
    "ai_disclosure_requirements": {
      "value": {
        "disclosure": null,
        "prohibited_generation": "Wholly or largely AI-generated submissions prohibited; AI editing allowed.",
        "authorship": null
      },
      "source_url": "https://www.usenix.org/conference/osdi26/call-for-papers",
      "source_type": "call_for_papers",
      "verified_at": "2026-10-08",
      "applies_to": {
        "venue_id": "OSDI",
        "year": 2026,
        "track": "operational-systems",
        "submission_stage": "submission"
      },
      "verification_status": "verified",
      "notes": "Submission Policies"
    },
    "artifact_reproducibility_policy": {
      "value": null,
      "source_url": null,
      "source_type": "unknown",
      "verified_at": null,
      "applies_to": {
        "venue_id": "OSDI",
        "year": 2026,
        "track": "operational-systems",
        "submission_stage": "submission"
      },
      "verification_status": "unverified",
      "notes": "UNKNOWN: no verified applicable official rule retained; consult exact target instructions."
    },
    "writing_style_guidance": {
      "value": {
        "kind": "official_guidance",
        "items": [
          "Title must end with (Operational Systems); explain deployment and operational lessons."
        ]
      },
      "source_url": "https://www.usenix.org/conference/osdi26/call-for-papers",
      "source_type": "call_for_papers",
      "verified_at": "2026-10-08",
      "applies_to": {
        "venue_id": "OSDI",
        "year": 2026,
        "track": "operational-systems",
        "submission_stage": "submission"
      },
      "verification_status": "verified",
      "notes": "Submission Tracks"
    },
    "field_specific_evaluation_priorities": {
      "value": {
        "kind": "independent_guidance",
        "items": [
          "Check end-to-end effects, representative workloads, tail latency, scalability, overhead and failures.",
          "Recognize design, integration, measurement and operational insights as contributions."
        ]
      },
      "source_url": null,
      "source_type": "field_methodology",
      "verified_at": null,
      "applies_to": {
        "venue_id": "OSDI",
        "year": 2026,
        "track": "operational-systems",
        "submission_stage": "submission"
      },
      "verification_status": "unverified",
      "notes": "Independent field methodology, select metrics by claim; not mandatory venue review criteria."
    }
  },
  "writing_style_observations": [],
  "notes": "Exact named edition and track only; historical edition cannot establish a later edition's rules."
}
