{
  "schema_version": 1,
  "venue_id": "NSDI",
  "year": 2027,
  "track": "research",
  "submission_stage": "submission",
  "publication_type": "conference",
  "official_source_urls": [
    "https://www.usenix.org/conference/nsdi27/call-for-papers"
  ],
  "last_verified_date": "2026-10-08",
  "rules": {
    "paper_length_policy": {
      "value": {
        "max_pages": 12,
        "basis": "main"
      },
      "source_url": "https://www.usenix.org/conference/nsdi27/call-for-papers",
      "source_type": "call_for_papers",
      "verified_at": "2026-10-08",
      "applies_to": {
        "venue_id": "NSDI",
        "year": 2027,
        "track": "research",
        "submission_stage": "submission"
      },
      "verification_status": "verified",
      "notes": "What to Submit"
    },
    "reference_page_policy": {
      "value": {
        "excluded": true,
        "limit": null
      },
      "source_url": "https://www.usenix.org/conference/nsdi27/call-for-papers",
      "source_type": "call_for_papers",
      "verified_at": "2026-10-08",
      "applies_to": {
        "venue_id": "NSDI",
        "year": 2027,
        "track": "research",
        "submission_stage": "submission"
      },
      "verification_status": "verified",
      "notes": "What to Submit"
    },
    "appendix_supplementary_policy": {
      "value": {
        "extra_appendix_pages": true,
        "review_optional": true
      },
      "source_url": "https://www.usenix.org/conference/nsdi27/call-for-papers",
      "source_type": "call_for_papers",
      "verified_at": "2026-10-08",
      "applies_to": {
        "venue_id": "NSDI",
        "year": 2027,
        "track": "research",
        "submission_stage": "submission"
      },
      "verification_status": "verified",
      "notes": "What to Submit"
    },
    "template_requirements": {
      "value": {
        "required": false,
        "documentclass": null,
        "options": [],
        "font_size_pt": 10,
        "columns": 2
      },
      "source_url": "https://www.usenix.org/conference/nsdi27/call-for-papers",
      "source_type": "call_for_papers",
      "verified_at": "2026-10-08",
      "applies_to": {
        "venue_id": "NSDI",
        "year": 2027,
        "track": "research",
        "submission_stage": "submission"
      },
      "verification_status": "verified",
      "notes": "What to Submit; USENIX template optional"
    },
    "anonymity_requirements": {
      "value": {
        "double_blind": true,
        "scope": "Authors, affiliations, funding and personal links; different title/system name for technical reports."
      },
      "source_url": "https://www.usenix.org/conference/nsdi27/call-for-papers",
      "source_type": "call_for_papers",
      "verified_at": "2026-10-08",
      "applies_to": {
        "venue_id": "NSDI",
        "year": 2027,
        "track": "research",
        "submission_stage": "submission"
      },
      "verification_status": "verified",
      "notes": "What to Submit and Other Policies"
    },
    "review_criteria": {
      "value": [
        "New idea with compelling evaluation; networked-systems contribution; introduction prescreening (at most three pages)."
      ],
      "source_url": "https://www.usenix.org/conference/nsdi27/call-for-papers",
      "source_type": "call_for_papers",
      "verified_at": "2026-10-08",
      "applies_to": {
        "venue_id": "NSDI",
        "year": 2027,
        "track": "research",
        "submission_stage": "submission"
      },
      "verification_status": "verified",
      "notes": "Submission Tracks and Prescreening Phase"
    },
    "ai_disclosure_requirements": {
      "value": {
        "disclosure": "HotCRP attestation: text primarily human written.",
        "prohibited_generation": "Entire or substantively AI-written paper prohibited; generating an entire section is a violation; grammar/clarity edits permitted.",
        "authorship": null
      },
      "source_url": "https://www.usenix.org/conference/nsdi27/call-for-papers",
      "source_type": "call_for_papers",
      "verified_at": "2026-10-08",
      "applies_to": {
        "venue_id": "NSDI",
        "year": 2027,
        "track": "research",
        "submission_stage": "submission"
      },
      "verification_status": "verified",
      "notes": "On the Use of Generative AI"
    },
    "artifact_reproducibility_policy": {
      "value": null,
      "source_url": null,
      "source_type": "unknown",
      "verified_at": null,
      "applies_to": {
        "venue_id": "NSDI",
        "year": 2027,
        "track": "research",
        "submission_stage": "submission"
      },
      "verification_status": "unverified",
      "notes": "UNKNOWN: no verified applicable official rule retained; consult exact target instructions."
    },
    "writing_style_guidance": {
      "value": {
        "kind": "official_guidance",
        "items": [
          "Introduction at most three pages; articulate track-specific contribution and evaluative claims."
        ]
      },
      "source_url": "https://www.usenix.org/conference/nsdi27/call-for-papers",
      "source_type": "call_for_papers",
      "verified_at": "2026-10-08",
      "applies_to": {
        "venue_id": "NSDI",
        "year": 2027,
        "track": "research",
        "submission_stage": "submission"
      },
      "verification_status": "verified",
      "notes": "Prescreening Phase"
    },
    "field_specific_evaluation_priorities": {
      "value": {
        "kind": "independent_guidance",
        "items": [
          "Check end-to-end effects, representative workloads, tail latency, scalability, overhead and failures.",
          "Recognize design, integration, measurement and operational insights as contributions."
        ]
      },
      "source_url": null,
      "source_type": "field_methodology",
      "verified_at": null,
      "applies_to": {
        "venue_id": "NSDI",
        "year": 2027,
        "track": "research",
        "submission_stage": "submission"
      },
      "verification_status": "unverified",
      "notes": "Independent field methodology, select metrics by claim; not mandatory venue review criteria."
    }
  },
  "writing_style_observations": [],
  "notes": "Exact named edition and track only; historical edition cannot establish a later edition's rules."
}
